,job_title,company,salary,location,date,job_desc
99,"Assistant Professor, Data Science",Embry-Riddle,Full-time +1,Remote,PostedPosted 4 days ago,"Potential for excellence in data science research.
Established or promising trajectory of research in data science."
100,Data Privacy SME,Cognizant,"$130,000 - $200,000 a year","Remote in Seattle, WA",PostedPosted 12 days ago,"Reporting and tracking of data management activities, support synergies between data governance operations, data privacy and information security, policy and…"
101,Healthcare Data Scientist REMOTE,DOCS Management Services,"$78,000 - $95,000 a year","Remote in Coos Bay, OR 97420",PostedPosted 9 days ago,"Analyze data with statistical methods, interpret results, and provide written summaries/reports and/or data visualizations of data analysis."
102,Freelance NLP Developer,ContentLab.io,Part-time,Remote,EmployerActive 2 days ago,"Get paid well to write about your passions while educating other developers with your own voice.
Discover new technologies and have the opportunity to work…"
103,Data Science Lead Trainer (Part time),Institute of Data,$65 - $75 an hour,Remote,PostedPosted 9 days ago,"You have at least 3 years of professional data science experience.
Data science: 3 years (Required).
You have a deep understanding of statistical hypothesis…"
104,"Senior Data Consultant, Account Manager - Life Science - Remote",UnitedHealth Group,"$82,100 - $146,900 a year","Remote in Boston, MA 02212",PostedPosted 3 days ago,"1+ years of experience evaluating data to present findings based on business deliverable/requirements (role is client facing role, not data analysis role)."
105,"MANAGER, DATA SCIENCE - FORECASTING (REMOTE OPPORTUNITY)",Hyatt Corporate,Full-time,"Remote in Chicago, IL",PostedPosted 3 days ago,"5+ years of data science experience with a focus on forecasting, hospitality experience not required.
Report on forecast accuracy, bias, and incremental…"
106,Data Scientist,MD Anderson Cancer Center,Full-time,"Remote in Houston, TX 77030",PostedPosted 7 days ago,"Build data science tools and predictive algorithms focusing on graph-based statistics and technologies.
Perform data wrangling and preparation for deep learning…"
107,Data Engineer,MCG Health,"$115,430 - $156,170 a year","Remote in Seattle, WA 98104",PostedPosted 10 days ago,"You have knowledge of healthcare data coding systems and common administrative data formats.
Develop self-healing data pipelines with robust logging."
108,Data Onboarding Analyst,S&P Global,"$58,300 - $115,000 a year","Remote in Boston, MA 02108",PostedPosted 10 days ago,"Experience within data science or data engineering preferred.
Assist data stewards in analysing new data sources for quality and ease of integration."
109,Senior Data Analyst,Timely MD,"$90,000 - $100,000 a year",Remote,PostedToday,"Mentor junior analysts in all things data analytics and data visualization best practices.
QA/QC data to ensure accuracy.
Bachelor's Degree or higher."
110,"Course Instructors: Software Experts; Data Science, WebDev, Cloud Computing",KnowledgeCity,"Up to $4,500 a month",Remote,Hiring ongoing,"KnowledgeCity* is a global leader in eLearning training, with courses covering Business, Finance, Compliance, Safety and Software."
111,"Director, Data Engineering (Remote)",CrowdStrike,"$175,000 - $250,000 a year",Remote,PostedPosted 3 days ago,Lead the Data Engineering team that powers the big data processing for CrowdStrike’s machine learning-based detection technologies.
112,Data Engineer,"Hornblower Group, Inc","$65,000 - $100,000 a year",Remote,PostedPosted 2 days ago,"Experience with big data and cloud platforms to deploy large-scale data science solutions.
The Data Engineer, Data Management will be responsible for data…"
113,Senior Data Analyst,Logicalis,Full-time,Remote,PostedPosted 8 days ago,"Combines disparate data sources into a unified data model.
Strong reporting, and data analytics background, including data visualization."
114,Senior Mathematical Data Scientist,American Institutes for Research,Full-time,Remote,PostedPosted 5 days ago,"Developing software, algorithms, and applications to apply mathematics to data and build data-driven applications that translate data into computational…"
115,Project Management Analyst,IQVIA,Full-time,Remote,PostedPosted 3 days ago,"Bachelor's Degree Life sciences or other related field Req.
Ensure PL has timely and accurate data on areas including cost, schedule, scope, utilization, change…"
116,"Manager, Data Science - Remote",XPO Logistics,Internship,"Remote in Dallas, TX",PostedPosted 8 days ago,"Experience with data modeling and data architecture.
Superior skills in data mining and data cleansing techniques."
117,Data Engineer,BlastPoint,"$120,000 - $160,000 a year",Remote,PostedPosted 6 days ago,"2+ years of work experience in data engineering, software engineering, data science, or a related discipline.
Advanced proficiency developing Python code that's…"
118,"Senior Data Analyst, Claims",The Hanover Insurance Group,Full-time,Remote,PostedPosted 9 days ago,"Demonstrated problem-solving skills and ability to perform exploratory data analysis.
The Senior Data Analyst will use claims data to provide insight into…"
119,Data Scientist,OpTech LLC,$55 - $60 an hour,Remote,PostedPosted 8 days ago,"Proven experience working as a data/AI Product Owner or managing data/AI projects using Agile processes.
4-5 years related work experience, including two to…"
120,Data and Insights Manager – Global Nike Direct Digital Commerce (Remote Option*),Nike,"$107,000 - $161,500 a year","Remote in Beaverton, OR",PostedPosted 10 days ago,"Strong experience in data warehousing, dimensional modeling and the ability to bring standard methodologies with regard to data management, ETL, API…"
121,Data Engineer,MD Anderson Cancer Center,Full-time,"Remote in Houston, TX 77030",PostedPosted 4 days ago,"Create data pipelines to validate and enrich data for use in ML models.
Central to this vision, the Data Engineer will build and maintain data infrastructure to…"
122,Data Scientist / Machine Learning Engineer in California or Oregon,Bright Apps LLC,"$100,000 - $120,000 a year","Remote in Portland, OR",EmployerActive 3 days ago,"Supervising the data acquisition process if more data is needed.
Supervising the data acquisition process if more data is needed."
123,Waste Methane Data Manager – Climate Aligned Industries,Rocky Mountain Institute,"$103,000 - $121,000 a year",Remote,PostedPosted 8 days ago,"5+ years’ experience in data modeling & data science.
Oversee data management and data analytics for growing team of Climate analysts."
124,Data Scientist,Vetro Tech Inc,"$89,000 - $99,000 a year","Remote in Dallas, TX",Hiring ongoing,"Present information using data visualization techniques.
Undertake preprocessing of structured and unstructured data.
Combine models through ensemble modeling."
125,SQL Data Scientist,Security Finance,Full-time,"Remote in Spartanburg, SC 29307",PostedPosted 4 days ago,"Experience using SQL for data analysis and data extract.
Maintains relationship with other departments to obtain data.
Completes quarterly static pool analysis."
126,Parexel Statistical Programmer: Neurodiversity Hiring Initiative,Specialisterne,Full-time,Remote,PostedPosted 9 days ago,"Uses efficient programming techniques to produce derived datasets (e.g. SDTM, ADaM), tables, figures, and data listings of any complexity and QC low-medium…"
127,Data Science Research Institute Systems Administrator,Colorado State University,"$75,000 - $85,000 a year","Remote in Fort Collins, CO",PostedToday,"Troubleshoot problems with computing, data storage or related hardware, determine likely causes and work with hardware vendors and researchers to coordinate…"
128,"Senior API Engineer, Data Science",Medidata Solutions,"$114,000 - $153,000 a year","Remote in New York, NY 10003",PostedPosted 10 days ago,"This role will partner heavily with all of the key stakeholder functions including product, delivery, data science, engineering, partnerships, and biostatistics…"
129,Computer Science - Data Services Architect (RD3),Argonne National Laboratory,Full-time,"Remote in Lemont, IL 60439",PostedPosted 7 days ago,"Design intuitive science focused web-based tools for teams and communities to manage, curate, analyze, share and collaborate with the data generated by their…"
130,"Software Engineer, AWS",Live Nation,Full-time,"Remote in New York, NY",PostedPosted 1 day ago,"Degree in computer science, data science, mathematics, statistics, or other related discipline.
1+ years’ experience working with big data in a production…"
131,Senior Data Analyst,"TechFlow, Inc",Full-time,Remote,PostedPosted 11 days ago,"Understands data quality, data visualization techniques and standards.
Understand data modeling and how to interpret a relational data model when constructing…"
132,"Senior Data Scientist, Genetics",Harnham,"$165,000 - $185,000 a year","Remote in San Francisco, CA",PostedPosted 3 days ago,"Industry experience using and developing methods for analyzing human genetic data.
This bay area series A start-up is searching for a Senior Data Scientist with…"
133,Sr. Data Scientist,ThirdEye Data Inc.,"$140,000 - $160,000 a year",Remote in California,PostedPosted 9 days ago,"Data science: 5 years (Required).
Predict physical event location on distribution leveraging all data.
Anomaly detection to extract unlabeled event signatures…"
134,Senior Data Scientist,Engtal,"$150,000 - $185,000 a year",Remote,PostedPosted 3 days ago,"Proficiency with data mining and machine learning.
Communicate with departments to understand data requirements and plan new projects."
135,Business Analyst,"Cognosante, LLC",Full-time,Remote,PostedPosted 4 days ago,"Possess ability to perform data analysis, risk identification and process improvement.
Ability to analyze data and complex problems, interpret and recommend…"
136,Business Analyst – Associate eCOA Licensing and Translations Manager,IQVIA,Full-time,Remote,PostedPosted 10 days ago,"Elicit, document and analyze data to understand project goals and customer requirements for delivery.
The IQVIA electronic Clinical Outcome Assessment (eCOA)…"
137,Data Analyst Technical Senior,Intermountain Healthcare,$42.63 - $67.13 an hour,"Remote in Murray, UT",PostedPosted 2 days ago,"Advanced SQL ability, knowledge of database design, data modeling and standardized data structures.
They have a deep understanding of the clinical and operating…"
138,"Data Scientist or Statistician, Postdoc",UT Southwestern Medical Center,"$67,000 - $120,000 a year",Remote,PostedPosted 7 days ago,"For data scientists, the projects include assembling and statistical analyses of big clinical data, and application of machine learning and deep learning…"
139,Lead Data Scientist,CVS Health,"$115,000 - $230,000 a year","Remote in New York, NY",PostedPosted 9 days ago,"Bachelor's degree in quantitative field, such as statistics, economics, data science or computer science.
Experience using advanced analytics tools to combine…"
140,"Senior Analyst, Data Science",Adtalem Global Education,"$90,000 - $130,000 a year",Remote,PostedPosted 11 days ago,"Excellence in one of the data science toolkits, such as Python, SPSS, and R.
Strong data-orientation with the ability to process ambiguous and/or seemingly…"
141,"Manager, Marketing Analytics",Teladoc Health,"$86,000 - $130,000 a year",Remote,PostedPosted 12 days ago,"Curious about marketing initiatives and data; utilize data to drive insights.
5+ Years related experience in marketing analytics, data science or a similarly…"
142,Sr. Principal Business Data Analyst,"ABC Financial Services, Inc.",Full-time,Remote,PostedPosted 2 days ago,Company : ABC Fitness Solutions It's fun to work in a company where people truly BELIEVE in what they're doing! We're committed to bringing passion and…
143,AI Engineer,Engtal,"$200,000 - $220,000 a year",Remote,PostedPosted 4 days ago,"Experience with Python data science libraries, such as numpy, scipy, pandas, and matplotlib.
Experience processing large time-series data in multiple dimensions…"
144,Data Scientist - Patient Reported Outcomes,Dana-Farber Cancer Institute,Full-time,"Remote in Boston, MA 02215",PostedPosted 1 day ago,Provide quantitative data analysis and reporting support to I&A clients in areas related to use of patient reported data.
145,Healthcare Data Engineer,NOMS Healthcare,Full-time,"Remote in Amherst, OH 44001",PostedPosted 4 days ago,"At least 3 years of experience in developing data ingestion, data processing and analytical pipelines for big data, relational databases, NoSQL and data…"
146,Lead Data Scientist,Purple Drive Technologies,"$100,000 - $175,000 a year",Remote,PostedPosted 2 days ago,"Minor in computer science and/or formal advanced computer science coursework preferred.
1+ years designing and programming/coding data structures for large…"
147,Data Platform Architect,Bank of Hope,"$170,000 - $180,000 a year",Remote,PostedPosted 8 days ago,"Sound understanding of data governance processes, data quality, data integrity solutions.
Establish and promote data quality, data lineage, data management…"
148,Data Analyst,Big Fish Games,Full-time,"Remote in Las Vegas, NV 89135",PostedPosted 8 days ago,"This position will require not only a deep understanding of the game data and taxonomy, but the ability to query data, manipulate data, and deliver basic…"
149,Data Scientist,IQVIA,Full-time,Remote,PostedPosted 4 days ago,"Knowledge of cloud services (e.g. AWS) and developing data science projects.
Expertise in end-to-end data science techniques."
150,Data Scientist (Remote),Improvix Technologies,Full-time,"Remote in Reston, VA 20190",PostedPosted 13 days ago,Minimum of 3 years (5-7 years preferred) performing exploratory data analysis to understand the characteristics of a data set and identify potential issues.
151,"Analyst, Integrated Analytics",The J. M. Smucker Company,Full-time,Remote,PostedPosted 10 days ago,"Continuously develops own capabilities in Syndicated data, the Trade Promotion Management system, account specific data, JMS financial data, advanced Excel…"
152,Data Analyst - 100% REMOTE,TDMK Digital,Full-time,"Remote in Washington, DC 20001",PostedPosted 10 days ago,"Acquire data from primary and other data sources and maintain databases/data systems.
Analyze source data and types, identify data requirements for destination…"
153,Data Governance Analyst,SimulStat,Contract,Remote,PostedPosted 9 days ago,"Understanding of current trends in clinical data science, data usage, and data governance.
Understanding of study data, i.e. clinical trial data, observational,…"
154,Data Engineer (Remote),Curinos,"$126,000 - $140,000 a year","Remote in New York, NY 10017",PostedToday,Support an ecosystem of proprietary and third-party tools and technologies to empower high performing ML/data engineering and data science teams.
155,Associate Data Annotation Specialist (Remote),Synthetaic,Part-time,"Remote in Milwaukee, WI",PostedPosted 5 days ago,"Completing (or completed) studies in data science, data entry and data analysis.
Using our product, RAIC (Rapid Automatic Image Categorization), you’ll be…"
156,Application Developer - Rare Diseases,Axle Informatics,Full-time,"Remote in Bethesda, MD",PostedPosted 2 days ago,"Prior health data/biomedical data experience.
Identify, collect, quality check and integrate rare disease data, such as disease characteristics, genetics and…"
157,Data Analyst - Research,SEIU 775 Benefits Group,Full-time,"Remote in Seattle, WA 98104",PostedPosted 8 days ago,"A genuine passion for data science and drive to communicate using data;
Exposure or experience in data governance, data engineering and/or data warehousing…"
158,Senior Data Analyst/Data Architect (100% Remote),ImagineX Consulting,Contract,Remote,PostedPosted 2 days ago,"6+ years of hands-on experience in data architecture, data warehousing, data modeling, ETL.
Ability to estimate data engineering work and cloud data…"
159,"Senior Manager, Data Science - Reinforcement Learning (Remote)",The Home Depot,"$140,000 - $280,000 a year","Remote in Atlanta, GA 30361",PostedPosted 5 days ago,"10% Technical Exploration & Development - Seek further knowledge on key developments within data science, technical skill sets, and additional data sources;…"
160,Senior Big Data Engineer,Allstate,"$92,000 - $120,000 a year",Remote,PostedPosted 10 days ago,"Experience in using software development to drive data science and analytic efforts.
Partners closely with team members on Big Data solutions for our data…"
161,Sr. Digital Experimentation Specialist,Internal Data Resources,$50 - $55 an hour,Remote,Hiring ongoing,"2+ years of specialized experience in optimization/experimentation, data science, or related field.
Experience in A/B & MVT testing, statistics, randomized…"
162,Business Intelligence Developer IV,Robert Half,Full-time,Remote,PostedPosted 1 day ago,"Consult with Sr.BI Data Architect to understand/confirm optimal data sources and data definitions.
Partners with senior data experts to source data from source…"
163,Data Scientist - Professional Services AI,CalypsoAI,Full-time,Remote,EmployerActive 5 days ago,"And with customers on the performance of Calypso AI solutions as well as data science issues.
Provide feedback to internal Calypso AI teams on data science,…"
164,Data Engineer,N9 IT SOLUTIONS,$40 - $45 an hour,Remote,PostedPosted 1 day ago,"Execute data architecture and data management projects for both new and existing data sources.
Assess data loads for tactical errors and build out appropriate…"
165,Clinical Data Specialist ||,Banjo Health,Full-time,Remote,PostedPosted 13 days ago,"Supports data analytics, including quality of care measures, to improve patient and operational outcomes.
The Clinical Data Specialist-II is responsible for…"
166,Sr Data Scientist (Remote),Vaco,"$170,000 - $180,000 a year","Remote in Charlotte, NC",PostedPosted 4 days ago,"Develop custom data models and algorithms to apply to data sets.
Assess the effectiveness and accuracy of new data sources and data gathering techniques."
167,eClinical Analyst,YPrime,Full-time,Remote,PostedPosted 7 days ago,"At YPrime, we help our clients in the pharma and biotech industries to collect data from patients using mobile devices, assign patients to study treatment…"
168,Senior Research Data Scientist III,Covered California,"$7,811 - $9,777 a month",Remote,PostedPosted 8 days ago,"At least 5 years of experience with data analytics, including data reporting, dashboards, financial modeling, etc."
169,[Remote] Data Analyst (9603-1),JND,Full-time,"Remote in Plano, TX",PostedPosted 7 days ago,Strong interpersonal skills and ability to build working partnerships with internal data partners as well as third party data providers.
170,Energy Data Specialist (Remote),"Frontier Energy, Inc.",Full-time,"Remote in Cazenovia, NY 13035",PostedPosted 3 days ago,"Bachelor’s degree in computer science, data science, or engineering (from an ABET accredited program) is required.
No relevant work experience necessary."
171,Senior Data Analyst,IQ Solutions Inc,Full-time,Remote,PostedPosted 11 days ago,Using best practices in data visualization to communicate the meaning of data and facilitate evidence-based decision-making.
172,"Corporate Director, Data Engineering",Shriners Children's,Full-time,Remote,PostedToday,"The Corporate Director of Data & Analytics will provide thought leadership, oversight, and hands on management for the enterprise data engineering and platforms…"
173,Operations Research Analyst (Data Scientist),US Defense Human Resources Activity,"$56,983 - $88,792 a year","Remote in Wallops Island, VA",PostedPosted 4 days ago,"Provide expert analysis using machine learning and data mining methods for prediction,and ingest and combine data from a wide variety of sources."
174,Data Scientist- Coding Dojo Hiring Partner,CODING DOJO INC,Full-time,Remote,PostedPosted 12 days ago,"Type: Full Time; Direct Hire.
This role would be focused on building, testing and training ML models and working with the engineer teams to incorporate them…"
175,Sr HRIT Reporting & Data Analyst,Northeastern University,"$100,035 a year","Remote in Boston, MA",PostedPosted 7 days ago,Data integrity and security responsibilities include: Lead efforts to manage data audits and reconcile HR data integration issues to enhance overall data…
176,Director - Workers Compensation Loss Analytics and Reserving,"The Travelers Companies, Inc.","$125,600 - $207,200 a year","Remote in Hartford, CT",PostedPosted 1 day ago,"In Business Insurance Actuarial and Analytics, we deliver tailored analytics and innovative data science solutions that influence decisions and enable superior…"
177,Machine Learning Engineer,Packback Inc,"$85,000 - $130,000 a year",Remote,PostedPosted 2 days ago,"Excellent SQL skills and experience with ETL/ELT data modeling processes.
Hands-on experience throughout the machine learning lifecycle: data transformation,…"
178,Reimbursement Analyst,Craneware,Full-time,Remote,PostedPosted 1 day ago,"Basic knowledge with analytics, data science, and business intelligence tools.
Strong analytical skills the ability to draw conclusions based on data."
179,"Research Data Scientist, Disease Forecasting",EcoHealth Alliance,"$70,000 - $80,000 a year","Remote in New York, NY 10018",PostedPosted 10 days ago,"Produce high-quality data visualizations and written reports/manuscripts on data science and modeling project outputs, targeting audiences with a wide range of…"
180,Business Analyst-Supply Chain Design - REMOTE,Martin Brower,Full-time,Remote,PostedPosted 10 days ago,"Data science: 1 year (Preferred).
Expertise with data analysis including a high proficiency in Excel.
Prior experience with data visualization tools (PowerBI,…"
181,Applied NLP Engineer,Unwrap.ai,"$100,000 - $150,000 a year",Remote,PostedPosted 8 days ago,"Our founders, two ex-Amazon Alexa Product Managers, were tired of manually sifting through customer reviews, support tickets, and bugs while working on Alexa."
182,Director - Data Science Development,"Availity, LLC.",Full-time,"Remote in Jacksonville, FL 32256",PostedPosted 2 days ago,"Knowledge in healthcare business and data.
Partnering closely with Product, Engineering and Design leadership to drive impact throughout the product development…"
183,Senior Data Analyst,"RELI Group, Inc.",Full-time,Remote,PostedPosted 9 days ago,"Skilled in analyzing large data sets.
Analyze program data using statistical and relational database software; research contents, limitations, and potential…"
184,Transportation Data Analyst,VSE Careers,Full-time,"Remote in San Diego, CA",PostedPosted 9 days ago,"Creating data frameworks for automated data transfer.
Master’s degree in data science or equivalent.
Qualified candidates will be graduates with a degree in…"
185,Part Time Data Scientist/Statistician,Ardent Eagle Solutions,Part-time,"Remote in Washington, DC 20230",PostedPosted 9 days ago,"The data analyst will be responsible for data mapping and extract, transform, load (ETL) activities as needed."
186,Business Analyst,Hertz,Full-time,"Remote in Estero, FL 33928",PostedPosted 3 days ago,"Using statistical computer languages to manipulate data and draw insights from large data sets.
Analyzing data from 3rd party providers."
187,Compliance Quantitative Data Analyst,NetSpend,"$90,000 - $100,000 a year",Remote,EmployerActive 3 days ago,"Quantifies value of new data sources, data elements, and alternative modeling approaches.
Solid understanding of relational databases and confident extracting…"
188,"First Analytics Hire (Remote, North America)",Magical,Full-time,"Remote in Ontario, CA",PostedPosted 1 day ago,"Proficiency with Tableau or data visualization tools is preferred, but not required.
Leveraging your knowledge of data, run quant studies with our user-base…"
189,Job Open for Data Scientist with Azure_Remote,Tekshapers Software Solutions Pvt Ltd,Up to $80 an hour,Remote,EmployerActive 2 days ago,"Lead architectures design, data source acquisition and analysis, data extraction, transformation etc.
Convert the business questions into data engineering…"
190,Senior Claims Data Analyst,Village Care,"$77,506 - $87,195 a year",Remote,PostedPosted 7 days ago,"The role combines technical skills (MS Excel, SQL, database and Tableau) in order to evaluate claims system coding, analyze claims and data, manage underpayment…"
191,Senior Data Scientist,PAYLOCITY CORPORATION,"$145,000 - $170,000 a year",Remote,PostedPosted 9 days ago,"4-7 years of data science success at other software companies.
Demonstrated ability to leverage data science to drive business results."
192,Data Scientist,FocusKPI Inc.,Full-time +1,"Remote in San Bruno, CA",PostedToday,"3+ years of industry experience in data, analytics, data science role.
Manage and streamline data extraction process with great attention to details."
193,Data Scientist,Catalist,"$75,000 - $85,000 a year",Remote,PostedPosted 11 days ago,"Design and execute high priority data science projects, from planning to evaluation and deployment.
Demonstrated experience in creating predictive models or…"
194,Senior Manager | Data Science - Kalypso,Rockwell Automation,"$200,560 - $250,700 a year","Remote in Houston, TX",PostedPosted 2 days ago,You should also have at least 8+ years of working experience in a data science capacity preferably working as a Senior Data Scientist.
195,Data Scientist (Remote),Datawiz Corporation,"$130,000 - $160,000 a year","Remote in McLean, VA",PostedPosted 10 days ago,Responsible for identifying and capitalizing opportunities for leveraging data to build machine learning and data science pipelines.
