,job_title,company,salary,location,date,job_desc
0,"Principal Data Scientist, Online Visual AI (Remote)",The Home Depot,"$150,000 - $280,000 a year","Remote in Atlanta, GA 30361",PostedPosted 2 days ago,"Demonstrated mastery in predictive modeling, data mining and data analysis.
Principal Data Scientists focus on seeking out business opportunities to leverage…"
1,Senior Data Scientist,Underdog.io,"$157,872 - $166,937 a year",Remote,PostedPosted 9 days ago,"Our companies look for Data Scientists who are comfortable working with large data sets using Snowflake, dbt, SQL, Hadoop, MapReduce, Hive, and more."
2,Data Integration Engineer,Peterson Technology Partners,$90 - $110 an hour,Remote,PostedPosted 8 days ago,Manage and scale data pipelines from internal and external data sources to support new product launches and drive data quality across product domains.
3,Data Architect - Vaccine Data Team - $53.71/hr,"Healthcare Staffing Professionals, Inc.",$53.71 an hour,"Remote in Los Angeles, CA",Hiring ongoing,"Option II: A bachelors degree from an accredited college in a field of applied research such as data science, machine learning, mathematics, psychology, or…"
4,Data Analyst,LendingUSA,"$62,400 - $90,000 a year",Remote,PostedPosted 3 days ago,"Bachelor’s Degree in data science, computer science, information systems, engineering or other related field (or equivalent experience) required."
5,Data Analytics Consultant - Gaming,Affine Inc,Full-time,Remote,PostedPosted 5 days ago,"We offer capabilities across the analytical value chain from analytics engineering and cloud-based implementations to analytics, machine learning, AI, and…"
6,Data Scientist,Expert Technical Solutions,"$150,000 - $160,000 a year",Remote,PostedPosted 3 days ago,"Design and upkeep explanatory data models.
Data science: 5 years (Required).
Work closely with analysts, traders, developers, and other data scientists to…"
7,Data Scientist,ESP IT,"$90,000 - $100,000 a year",Remote,PostedPosted 4 days ago,"Degree in computer science or data science or equivalent work experience.
Ingest text files/data from clients and run scripts to prepare data for topic…"
8,"Director I, Data Science",Liberty Mutual Insurance,"$149,100 - $210,200 a year",Remote,PostedPosted 3 days ago,"Regularly engages with the data science community and leads cross functional working groups.
Explore the advantages and limitations of privacy-preserving ML and…"
9,REMOTE Sr. Data Engineer,CyberCoders,"$130,000 - $180,000 a year","Remote in New York, NY 10007",PostedPosted 3 days ago,"Work with the product, data science and data operations team to understand business requirements and needs.
Help to architect and mentor the data team on best…"
10,Manager Data Science,Robert Half,Full-time,Remote,PostedPosted 11 days ago,"Analyzing large and complex data sets.
Enhance data collection procedures to include information that is relevant for building analytic systems."
11,Data Analyst,SRIVANGO TECHNOLOGIES,$60 - $70 an hour,Remote,PostedJust posted,"Minimum of 3+ years industry experience in data science.
Industry experience in data science: 3 years (Required).
Data Analyst: 7 years (Required)."
12,"BI/Tableau Specialist, Data Analyst, Senior Consultant",Guidehouse,Overtime,"Remote in McLean, VA 22101",PostedPosted 5 days ago,"This high performing team works with clients to implement the full spectrum of data analytics and data science, from data querying and data wrangling to data…"
13,Data Analyst,Disney,"$87,900 - $137,300 a year","Remote in Santa Monica, CA 90401",PostedPosted 4 days ago,"Familiarity and exposure to data modeling and data science concepts.
Minimum of 2+ years of experience in data analysis or data science, preferably within the…"
14,Data Analyst,"Esolvit Inc.,",$60 - $70 an hour,Remote,EmployerActive 4 days ago,"Clearance Required: * Public Trust (Full Clearance required to start).
Education Level* : BS in Mathematics, Economics, Computer Science, Information Management…"
15,Data Engineer I,1010data,"$88,000 - $103,500 a year","Remote in New York, NY",PostedPosted 2 days ago,"Ability to independently plan and collect requirements for projects, and interact with the analyst and data science teams."
16,Data Associate (Remote),CareFirst BlueCross BlueShield,Full-time,"Remote in Baltimore, MD 21224",PostedPosted 2 days ago,"Research and analyze data flow across data ecosystem including operational and analytical data platforms.
The main purpose of a data analyst is to find meaning…"
17,Synthetic Data Engineer,Frontier,Contract,Remote,Hiring ongoing,Augmented Reality (AR) and Virtual Reality (VR).
18,Health Data Scientist (Remote),"US News & World Report ,L.P.",Full-time,"Remote in Washington, DC 20007",PostedPosted 11 days ago,"On a day to day basis, you will write and review code to manage large Medicare administrative claims data sets and other data sources, coach other members of…"
19,Statisticians/Methodologists -- Part Time,Dissertation Editor,Part-time,Remote,PostedPosted 5 days ago,"We are seeking statisticians to (a) assist our clients in processing and analysing their data, and/or (b) advise on doctoral-level write up of methods, results,…"
20,Data Analyst,"Blue Rose Consulting Group, Inc.","$125,000 - $135,000 a year",Remote,PostedPosted 9 days ago,"Acquire data from primary and other data sources and maintain databases/data systems.
Analyze source data and types, identify data requirements for destination…"
21,"Product Manager, Data Science for SaaS Products",Marin Software,"$90,000 - $200,000 a year",Remote,PostedPosted 6 days ago,"Expertise in data analytics required (e.g. statistics, data science, machine learning - ability to interpret, analyze and make sense out of data)."
22,Data Analyst (Remote),Elligo Health Research,Full-time,Remote,PostedPosted 4 days ago,"Merge and organize the data in Microsoft Excel and other tools to produce data products.
Assist Elligo Data Science team with query electronic health record…"
23,Data Scientist,Red Hat Software,Full-time,Remote,PostedPosted 5 days ago,"In this role, you will develop and modify software systems model and predict outcomes based on the data generated by the company in both its business and…"
24,PQI Data Analyst,SCO Family of Services,"$60,000 - $65,000 a year",Remote,PostedPosted 3 days ago,"Mine data from primary and secondary sources, and refine data and layouts as needed.
Design, maintain, and improve dynamic data systems and databases by fixing…"
25,Data Scientist (remote),MultiPlan Inc.,"$110,000 - $130,000 a year",Remote,PostedPosted 2 days ago,"Mature our data science practice with continuous learning and knowledge sharing.
This position will work to enable deeper insights and better decision making…"
26,Data Engineer,APCO Holdings,"$85,000 - $95,000 a year",Remote,PostedPosted 5 days ago,"A data engineer's job is to provide the data used the data architecture and data science teams.
Collaborate with team regarding when to stage raw data versus…"
27,"Senior Data Scientist, Analytics",Discord,"$175,000 a year","Remote in San Francisco, CA 94107",PostedPosted 1 day ago,"If you’re passionate about data, impact, and working on an amazing team, read on and check out our blog about how our team informs strategy & innovation at…"
28,Data Scientist,BlastPoint,"$100,000 - $140,000 a year",Remote,PostedPosted 2 days ago,Deep understanding of statistics and other mindsets for building models from data; strong data acumen in translating business problems into supervised…
29,"Director, Data Science Delivery (remote)",MultiPlan Inc.,"$170,000 - $190,000 a year",Remote,PostedPosted 8 days ago,The director of data science delivery will lead the charge in building new intelligent products through the creation of optimized decisions using actionable…
30,Data Scientist,Largeton Inc,$60 - $75 an hour,Remote,PostedPosted 10 days ago,"*Deep technical expertise in data science, statistical modelling and/or machine learning*.
Data science: 9 years (Required)."
31,"Data Scientist, CV/NLP",Ancestry,Full-time,Remote,PostedPosted 4 days ago,Advocate for a data-driven culture and push long-term value creation through development of outstanding data science capabilities.
32,Data Science Product Owner (REMOTE),Abercrombie and Fitch Co.,"$140,000 - $157,000 a year","Remote in Columbus, OH",PostedToday,"Bachelor's degree required (master’s preferred) in disciplines related to data science, data analytics, mathematics or engineering, or other fields of science…"
33,Data Analyst,Tech-brothers Infoservices,$20.69 - $57.33 an hour,Remote,PostedPosted 12 days ago,Ability to perform complex data lineage analysis spanning multiple source systems and data transformations from a Capital data perspective.
34,Data Scientist,Wiland,"$82,000 - $113,500 a year",Remote,PostedPosted 11 days ago,"3+ years’ analytics experience in database marketing, data science, analysis and modeling.
Review and perform quality checks on existing data sources."
35,Data Engineer II,UW Health,"$84,600 - $126,800 a year","Remote in Madison, WI 53717",PostedPosted 3 days ago,"Leverage knowledge and skill with a variety of data engineering, DataOps, and data warehousing methodologies, techniques, tools, and platforms to move and…"
36,Sr. Data Engineer,S5 Stratos,"$83,119 - $154,509 a year",Remote,PostedPosted 9 days ago,"Translate business needs into data models: implement data strategies, build data flows and develop conceptual data models.
Expertise in SQL is a must."
37,Data Scientist,"Computer Enterprises, Inc. (CEI)",$73 - $83 an hour,Remote,PostedPosted 5 days ago,"Big data and BI visualization experience preferred.
Comfortable working with large and verbose data sets across a wide range of subject matter areas."
38,Data Analyst (Remote),Easy Payroll Global,$36 an hour,"Remote in San Francisco, CA",PostedPosted 3 days ago,"Analytics/data science: 5 years (Required).
Bachelor's degree in Computer Science, Math, Statistics, or another technical field and 5+ years of experience in…"
39,Senior Clinical Data Analyst,Ascension,"From $85,280 a year",Remote,PostedPosted 9 days ago,"Previous clinical/EHR data experience.
Compiles clinical data to meet customer requirements or analytic needs.
Schedule: Monday-Friday, 8 hour shift."
40,"Academic Program Manager/ Sr. Program Manager (Computer Science, Data Science, Mathematics)",Minerva Project,"$100,000 - $140,000 a year",Remote,PostedPosted 12 days ago,"Degree in computer science, data science, or mathematics discipline.
Combining design expertise, advanced digital technology, and leading educational science,…"
41,Senior Technical Product Manager – Data Science,Nuvalence,"$70,000 - $313,000 a year",Remote,PostedToday,"Experience with geospatial data is a plus.
Experience working with Data Scientists to create data pipelines, features stores, and model versioning stores that…"
42,Digital Marketing Analyst,Sunixa Solutions,$20 - $23 an hour,Remote,Hiring ongoing,"Job title: *Digital Marketing Analyst*.
*Familiar with targeting & measurement capabilities*.
*SQL preferred but not mandatory*.
Work to support test & learns."
43,Data Scientist,COMTEC INFORMATION SYSTEMS,$40.38 - $60.70 an hour,Remote,PostedPosted 2 days ago,"2-5 years’ experience in a data scientist or data analytics role.
Integrate internal and external data sources, be comfortable working with both structured and…"
44,Senior Data Analyst,ECI - Sacramento,Contract,Remote,PostedPosted 6 days ago,"One (1) year experience analyzing high volume data that are based on confidential data.
One (1) year experience on analyzing and interpreting large data sets."
45,Visualization Developer,VanderHouwen,Contract,"Remote in Beaverton, OR 97005",PostedPosted 11 days ago,"You enjoy finding relationships between disparate data sets and clarity in a muddied data environment.
Represent data visualization capability and community…"
46,Data Scientist (Remote),Parsons,Full-time,Remote,PostedPosted 8 days ago,"Administer data science software to control user access and installed packages and languages.
Experience in performing data science using statistics, ML, and…"
47,Data Scientist,"Cleerly, Inc.","$140,000 - $190,000 a year","Remote in Denver, CO",PostedPosted 9 days ago,"Researching new methods of measuring and analyzing large and highly complicated data sets.
You'll be working with other data scientists, data engineers,…"
48,Data Engineer,ROR Partners Inc,"$90,000 - $135,000 a year",Remote,PostedPosted 14 days ago,"Strong data modeling skills and familiarity with the Kimball data warehousing methodology.
Implement and maintain data pipelines between various data systems…"
49,Data Scientist (No C2C),NOVUS Professional Services Inc.,$70 - $90 an hour,Remote,PostedPosted 5 days ago,"Passionate about data maintenance, data quality control and all other important data analysis techniques.
Experience using a data science toolkit such as Python…"
50,Data Analyst/Data Scientist/Data Engineer,Excelgens,$30 - $65 an hour,Remote,Hiring ongoing,"Analyse environmental, social and governance (ESG) data to ensure the creation and configuration of our clients' accounts.
Data modeling: 2 years (Required)."
51,Data Engineer,Revel,"$120,000 - $160,000 a year","Remote in Brooklyn, NY",PostedPosted 1 day ago,"Strong warehouse data modeling skills.
Work directly with lots of other teams including data science/analytics, product, marketing, and the wider engineering…"
52,SENIOR DATA ANALYST,UniGroup,Full-time,Remote,PostedPosted 2 days ago,"Implements data quality tests and continuously review, optimize, and refactor data models in order to expand our data environments with ready to analyze data."
53,Data Scientist,Point1Solution,Full-time,Remote,PostedPosted 3 days ago,"Knowledge of United/Industry data sources.
Advanced quantitative skills, subject matter knowledge and data source expertise in at least one business area, good…"
54,Senior Data Engineer (Remote),Vail Resorts,"$99,900 - $135,120 a year",Remote,PostedPosted 2 days ago,"4+ years of working with data warehousing systems, ETL/ELT, data systems integration, and cloud data solutions including data lakes or managed services like…"
55,Director of Data Science & Analytics (Virtual/Remote),CODING DOJO INC,Full-time,Remote,PostedPosted 14 days ago,"Oversees all activities of the data analytics and data warehousing department.
Creates new data-driven approaches for the purpose of generating business…"
56,"Data Scientist, Fraud Risk Decision Science",PaymentGenes,Full-time,Remote,PostedPosted 8 days ago,"The successful candidate should have prior data science and/or analytics experience in Fraud Risk management.
Global Risk Decision Analytics and Capabilities is…"
57,Data Visualization Specialist,Enterra Solutions,Full-time,Remote,PostedPosted 1 day ago,"Integration with data storage solutions that may include databases, data lakes, data warehouses, blob stores, etc.
Automate report/data refresh where necessary;"
58,Sr. Data Scientist,Disney,"$143,800 - $199,900 a year","Remote in Glendale, CA",PostedPosted 4 days ago,"Familiarity with data exploration and data visualization tools such as Tableau, Looker.
Partnership: Partner closely with business stakeholders to identify and…"
59,"Senior Director, Talent Management Analytics / Data Science","Marriott International, Inc","$120,375 - $242,756 a year","Remote in Bethesda, MD",PostedPosted 7 days ago,"Establish best practices for the ethical use of data science for human capital management.
The Sr. Director will help to evangelize the adoption of data science…"
60,Healthcare Data Analyst- AR & Denials,Cloudmed,"$75,000 - $100,000 a year",Remote,EmployerActive 10 days ago,"Possess background or certification in data science.
The candidate needs to have a comprehensive understanding of how to use data, effectively analyze large…"
61,Systems Data Analyst (AWS) - $48/hr,73rd Solution,$48 an hour,Remote,PostedPosted 4 days ago,"Minimum four (4) years of experience in data science data mining, and/or data analysis.
The Data Analyst will provide expertise in data collection, data…"
62,Data Scientist,Insight Global,$60 - $70 an hour,Remote,PostedPosted 2 days ago,"Developing application driven data science.
10-40% miscellaneous data science work (ie, model building and enhancements).
Data science skills: Python, SQL."
63,Machine Learning Operations Architect - REMOTE,Mint-Technologies,$40 - $60 an hour,Remote,PostedPosted 3 days ago,"Experience in data-oriented workflow orchestration frameworks.
Machine Learning Ops Architect maintains ownership of the strategic direction and roadmaps…"
64,Data Analyst,Devcare Solutions,$60 - $65 an hour,"Remote in Columbus, OH",PostedPosted 10 days ago,"You will be joining a team of analytics and data science professionals within the Enterprise Data & Analytics COE.
Web analytics: 1 year (Preferred)."
65,Senior Data Analyst,Data Ideology,Full-time +2,Remote,PostedPosted 4 days ago,"Understanding of basic querying of a data warehouse and data analysis.
1+ years experience in data analytics on any data warehouse (Oracle, SQL, Google Cloud,…"
66,Business Process Analyst 2,IQVIA,Full-time,Remote,PostedPosted 2 days ago,"Evaluates data by searching for trends and understanding the financial terms of the contracts.
Validate appropriate data from internal and third-party systems…"
67,Customer Product Data Scientist,Treehouse Foods,Full-time,Remote,PostedPosted 9 days ago,"Collecting and analyzing product data across multiple categories.
3 years’ experience in nutrition, culinary or food science.
MS Office, word, excel, etc."
68,Junior Data scientist/Programmer Analyst,AIVantage INC,"From $70,000 a year",Remote,EmployerActive 2 days ago,"Additional proprietary software (e.g. data analysis software).
Statistical products are predominantly developed in-house, though data and products may."
69,"Manager, Customer Voice (Remote)",Bright Horizons Family Solutions,"$75,000 a year","Remote in Newton, MA 02459",PostedPosted 7 days ago,"The Manager, Customer Voice is responsible for supporting the Customer Voice team in researching up-to-date customer voice best practices that achieve Bright…"
70,Analytics Consultant - Clinical Operations,UW Health,"$70,000 - $104,800 a year","Remote in Madison, WI 53717",PostedPosted 12 days ago,"Skill to develop a deep understanding and powerful displays of data.
Passion to dig into data and effectively articulate its end use."
71,Senior Data Engineer,Engtal,"Up to $230,000 a year",Remote,PostedPosted 3 days ago,"Help build the next generation of data products with us.
Build and implement data solutions to help drive strategic business decisions."
72,Marketing Data Scientist,Stefanini,$43 - $57 an hour,"Remote in Durham, NC 27709",Hiring ongoing,"Using data science packages in python with the purpose of providing market insights through data analysis.
Seeking candidates that have competed a undergraduate…"
73,VP Data Science,GM Financial,Full-time,"Remote in Fort Worth, TX 76102",PostedPosted 2 days ago,"Comprehensive knowledge and experience with technical systems, datasets, data warehouses, and data analysis techniques.
Python, R, and SAS programming required."
74,Survey Supervisor,Kalibrate,"$50,000 - $55,000 a year",Remote,PostedPosted 1 day ago,"Collection of detailed location data.
Collection of data at each site within markets.
Prep required maps and data for markets surveys."
75,Lead Data Analyst,opentext,"$99,000 - $148,000 a year",Remote,PostedPosted 13 days ago,"Proficiency in navigating data architecture.
Experience designing and implementing data models.
Experience with leveraging data from CRM and ERP systems."
76,Sr Data Analyst,Github,"$89,200 a year",Remote,PostedPosted 10 days ago,"Strong data modeling knowledge and creating ETL pipelines.
Build and maintain data models and dashboards.
Proficiency using SQL for collecting, organizing, and…"
77,UI/UX and Data Visualization Designer,Adaviv,Full-time +2,Remote,PostedPosted 5 days ago,"Adaviv is bringing automation and plant-level insights to controlled-environment farming, by using artificial intelligence to identify and track the health of…"
78,Data Analytics Consultant,ProCogia,Full-time,"Remote in Seattle, WA",PostedPosted 3 days ago,"The Data Analytics Consultant utilizes best practices in data preparation, UX and data analytics to provide our customers with highly informative and actionable…"
79,Data Analyst,Capio Group,Full-time,Remote,PostedPosted 3 days ago,"Experience must include data mapping, classification, and analysis for multiple IT systems and interfaces; analyzing current state data environments; and…"
80,Geospatial Data scientist,Zenotis Technologies INC,$70 - $80 an hour,Remote,EmployerActive 2 days ago,"Knowledge of transfer learning and making ML models work with limited data.
Good Understanding of image processing, color spaces, machine learning, deep…"
81,Data Science Architect,Belden Inc.,"$130,000 - $150,000 a year",Remote,EmployerActive 8 days ago,"Big data: 3 years (Required).
Lead and collaborate across groups to maximize the use of common machine learning and analytics technologies, conventions and…"
82,Lead Data Scientist,"Tantus Technologies, Inc","$160,000 - $175,000 a year",Remote,PostedPosted 7 days ago,"Overall 10+ years of experience in the data science field.
Data architecture, Data manipulation and data engineering of structured and unstructured data based…"
83,Machine Learning Engineer,ASA,Contract,Remote,PostedPosted 4 days ago,"Experienced in using SQL for querying data from relational tables.
Work collaboratively with data scientists, machine learning engineers, program and product…"
84,Data Engineer,V-Soft Consulting,"$83,953 - $90,614 a year",Remote,PostedPosted 13 days ago,Responsible for building and managing end-to-end data pipelines and operations from ingestion and integration through delivery for the data science prototypes…
85,"Senior Manager, Data Science CXI (Remote)",The Home Depot,"$140,000 - $280,000 a year","Remote in Atlanta, GA 30361",PostedPosted 5 days ago,"10% Technical Exploration & Development - Seek further knowledge on key developments within data science, technical skill sets, and additional data sources;…"
86,"Senior Data Scientist, Marketing & Online (Remote)",The Home Depot,"$90,000 - $190,000 a year","Remote in Atlanta, GA 30361",PostedPosted 2 days ago,"Demonstrated proficiency in predictive modeling, data mining and data analysis.
15% Technical Exploration & Development - Seek further knowledge on key…"
87,"Lead Data Scientist, Marketing & Online (Remote)",The Home Depot,"$120,000 - $240,000 a year","Remote in Atlanta, GA 30361",PostedPosted 2 days ago,20% Business Collaboration - Leverage extensive business knowledge into solution approach; Effectively develop trust and collaboration with internal customers…
88,Senior Data Analyst,Acunor,"$100,000 - $130,000 a year",Remote,PostedPosted 5 days ago,"Partner with data architects to build data models for efficient consumption of data.
Manipulate large data sets using SQL to understand patterns in the data."
89,Petroleum Engineer Data Scientist,Leidos,"$78,000 - $162,000 a year",Remote,PostedPosted 8 days ago,"Experience with or knowledge of wellbore systems and subsurface data.
Collaborate with an interdisciplinary team to develop scientific and data-driven methods…"
90,"Analyst ll, Credit Strategy Analyst( Work From Home)",First National Bank of Omaha,"$75,000 - $98,000 a year",Remote,PostedPosted 5 days ago,"2+ years of experience in credit risk management or other analytical field or an advanced degree with a focus on data science.
Data Analyst: 5 years (Required)."
91,Data Analyst - $36/hr (Remote),Suna Solutions,$30 - $36 an hour,Remote,PostedPosted 3 days ago,"Analytics and/or data science: 5 years (Preferred).
Bachelor's degree in Computer Science, Math, Statistics, or another technical field and 5+ years of…"
92,Data Scientist - Fully Remote,Insight Global,$60 - $65 an hour,Remote,PostedPosted 4 days ago,"Data science: 5 years (Required).
5+ years of experience with Natural Language Processing (NLP).
Expertise in Analysis of & consulting on call transcripts."
93,Sr. Data Analyst,"Computer Enterprises, Inc. (CEI)",$35 - $42 an hour,Remote,PostedPosted 1 day ago,"Database knowledge - Not just pulling data, but creating links to data so that all metrics that they use are available.
Job Types: Full-time, Contract."
94,Sr. Manager Data Analytics(Remote Or Hybrid),TARGET,"$85,400 - $153,700 a year","Remote in Minneapolis, MN 55403",PostedPosted 7 days ago,"Partner with data product teams to sustainably automate/enhance data.
Candidates with data science (regression, clustering, forecasting, design of experiments)…"
95,Data Analytics Instructor and Coach,Multiverse,Full-time,Remote,PostedPosted 10 days ago,"The topics you will teach will progress through the program, starting with the data analytics fundamentals such as Excel, SQL, and visualizations with Tableau,…"
96,Visualization Developer,VanderHouwen,Contract,"Remote in Beaverton, OR 97005",PostedPosted 11 days ago,"You enjoy finding relationships between disparate data sets and clarity in a muddied data environment.
Represent data visualization capability and community…"
97,Data Scientist - W2 no C2C,TheHive,$50 - $80 an hour,Remote,PostedPosted 9 days ago,"Providing technical expertise in data storage structures, data mining, and data cleansing.
Commissioning and decommissioning of data sets."
98,Data Scientist,Shipwell,"$130,000 - $150,000 a year","Remote in Austin, TX",PostedPosted 11 days ago,"5+ years of professional business and data analysis or engineering experience, with strong focus on practical real world results."
