,job_title,company,salary,location,date,job_desc
196,Data Engineer - SQL/Python/ETL,ProFocus,"$150,000 a year",Remote,PostedPosted 9 days ago,"This engineer would help us integrate various internal and external data sources, expand our data systems and pipeline capabilities, help automate ML training…"
197,Data Scientist - Islamic Law,Millennial Tech,$40 - $48 an hour,"Remote in Boston, MA 02163",PostedPosted 9 days ago,"Intisar Rabb, the research data scientist will work actively to advance designated projects in line with our mission: to provide resources and promote research…"
198,Data Review Associate Scientist,Eurofins USA BioPharma Services,Full-time,"Remote in Lancaster, PA",PostedPosted 9 days ago,"Ensure that the client receives quality data by reviewing laboratory data for accuracy, clarity, and adherence to GMP and/or GLP regulations."
199,Data Loss Prevention Investigator,State Street,Full-time,"Remote in Quincy, MA",PostedPosted 9 days ago,"Knowledge and understanding of data organizing or structuring complex data across varied data sources.
Determine data classification of sensitive documents…"
200,NLP/C++ Junior Developer (Only on W2),TAJ Technologies Inc,"$70,000 - $100,000 a year",Remote,PostedPosted 4 days ago,"1.Demonstrable skills on developing algorithms with advanced data structures*.
 * Developing new data structures, algorithms, and information flow architectures…"
201,Senior Data Analyst,The Arena Group,Full-time,"Remote in New York, NY",PostedPosted 12 days ago,"Expertise with ad management and/or subscription data.
Run complex data analysis to help business leaders make critical decisions."
202,Senior Architect: Technology R&D,"The Travelers Companies, Inc.","$130,600 - $215,400 a year","Remote in Hartford, CT 06101",PostedPosted 1 day ago,"Heavy concentration in experimentation, advanced technologies, development, as well as data science tools and research using large data sets."
203,Senior Data Engineer,"Computer Enterprises, Inc. (CEI)",$80.75 an hour,Remote,PostedPosted 1 day ago,"Any experience with data science solutions or platforms.
Any experience with data science solutions or platforms.
Analyze and organize raw data."
204,Statistician,TMF Health Quality Institute,Full-time,Remote,PostedPosted 5 days ago,"Determines method for gathering data and designs processes for data collection.
Uses statistical software and a variety of statistical methods to gather,…"
205,Sr Data Scientist (Remote),Cognizant,"$120,000 - $140,000 a year","Remote in Dallas, TX 75254",PostedPosted 7 days ago,Strong sense of ownership to deliver valuable analysis through acquisition and application of domain knowledge; motivated to develop and work from a strong…
206,Process Mining Expert,Cloudflare,"$110,000 - $134,000 a year","Remote in Austin, TX",PostedPosted 4 days ago,"Prior work experience in data science and data modeling.
Maintain and enhance current data models and create new data models as needed to support the business…"
207,Digital Marketing Analyst,National Research Center for College & University...,Full-time,Remote,PostedPosted 8 days ago,"Analyze online user behavior, conversion data, user journey, funnel analysis and multi-channel attribution.
Encoura is looking for a Digital Marketing Analyst…"
208,Senior Data Engineer (Snowflake) - Remote,Vaco,"$135,000 - $140,000 a year",Remote,PostedPosted 3 days ago,"Mine raw data from production systems and third parties.
Experience in using statistical methods that derive actionable business meaning from data."
209,Azure Data Architect,Nebraska Furniture Mart,Full-time,Remote,PostedPosted 10 days ago,"Experience working with data stewards, application owners, end users and other stakeholders to design data structures and flows."
210,Data Analyst II,Massachusetts General Hospital(MGH),Full-time,"Remote in Charlestown, MA 02129",PostedPosted 12 days ago,"Field of Study/Additional Specialized Training: Computer science, data science, software engineering or related field.
Participate in the design of experiments."
211,Machine Learning Engineer (US - Remote),Expedia Group,$100 - $112 an hour,Remote,PostedPosted 10 days ago,"Work collaboratively with data scientists, machine learning engineers, program and product managers in the development of assigned components."
212,"Senior Financial Data Scientist, CG-1560-14 (FPL 14)",US Federal Deposit Insurance Corporation,"$112,622 - $243,500 a year","Remote in Wallops Island, VA",PostedPosted 2 days ago,"Analyzes a variety of data sources to provide data-driven analytical software to programmatically prepare, clean, and augment imperfect data (using techniques…"
213,ML/AI Developer,i2e Consulting,Full-time,Remote,PostedPosted 12 days ago,"Verifying data quality, and/or ensuring it via data cleaning by working with the data engineering team.
Supervising the data acquisition process if more data is…"
214,Sr Data Analyst (SQL/PowerBI),Braintrust,$100 - $125 an hour,"Remote in San Francisco, CA 94133",PostedPosted 5 days ago,"Expert data retrieval and manipulation skills.
Able to create meaningful dashboards from increasingly complex or messy data."
215,Machine Learning Ops Engineer-Data Scientist,CareMetx LLC,Full-time,Remote,PostedPosted 8 days ago,"Experience with building data pipelines in getting the data required to build and evaluate ML models, using tools like Apache Spark or other distributed data…"
216,Senior Data Scientist - CPLEX or OPL,Point1Solution,Full-time,Remote,PostedPosted 3 days ago,"Minor in computer science and/or formal advanced computer science coursework preferred.
1+ years designing and programming/coding data structures for large…"
217,Senior Data Scientist,Edgetensor Technologies,"$90,000 - $120,000 a year",Remote,PostedPosted 3 days ago,"Understanding data statistics, analyze algorithm failure and improve data pipeline to improve algorithm performance.
Manage team of data engineers."
218,Data Scientist III,LexisNexis Legal & Professional,Full-time,Remote,PostedPosted 9 days ago,"Work with product leaders to apply data science solutions.
Train robust NLP-based models a very large corpus of news and financial data."
219,Machine Learning Engineer,Engtal,"$200,000 - $250,000 a year",Remote,PostedPosted 4 days ago,Continuous learning pipelines for dynamically curating new training datasets of out-of-distribution inputs and failure modes that interact with data labeling…
220,Senior Data Scientist,Cvent,Full-time,"Remote in Tysons Corner, VA 22102",PostedPosted 4 days ago,"A Bachelor's degree in a quantitative field such as a natural science, math, statistics or computer science.
Skills in data exploration and interpretation."
221,Data Scientist,EXARCA INC,"$100,000 - $150,000 a year","Remote in New York, NY",EmployerActive 3 days ago,"Make and defend arguments using data and data-based insight.
Practical experience with data analysis and exploration, especially with diverse data sets."
222,Applied Scientist - Text-To-Speech (TTS) - Remote,Veritone,"$140,000 a year","Remote in Washington, DC 20022",PostedJust posted,"Improve processes and tooling for cleaning, processing and assessing training data.
Research, implement, integrate, evaluate and monitor state-of-the-art Text…"
223,Python ML Engineer,Reveleer,Full-time,Remote,PostedPosted 2 days ago,"Experienced in data parsing and manipulation as well as SQL.
Experience building and scaling AWS solutions - lambda, containers, etc."
224,WIDA STATISTICAL ANALYST,University of Wisconsin–Madison,"$50,000 a year","Remote in Madison, WI 53706",PostedPosted 5 days ago,"Bachelor's degree required in the field of psychometrics, statistics, data science, or related field.
10% Maintains organization of research records and…"
225,"Director, Technical Program Management AI/ML- (Remote)",Capital One,Full-time +1,Remote,PostedPosted 10 days ago,"Ability to simplify the technically complex and drive well-educated decisions across product, engineering, design, data science representatives."
226,"Sr. Data Analyst, Pricing & Packaging",AppFolio,Full-time,Remote,PostedPosted 7 days ago,"Strong skills in data analysis, data visualization, and data storytelling.
Tableau or similar data visualization experience.
Technical skills in SQL and Excel."
227,CRM Integration Developer,Bluleadz,"$47,510 - $100,420 a year",Remote,PostedPosted 12 days ago,"Curate data into usable data sets with HubSpot Operations Hub.
Identify opportunities for improved data quality and cleanliness."
228,Digital Marketing Analyst,Sojern,Full-time,"Remote in Omaha, NE",PostedPosted 3 days ago,"As an Analyst, you will play a critical role within the team by ensuring our campaigns are structured in an optimal way, data feeding decision making is…"
229,Business Process Analyst 1,IQVIA,Full-time,Remote,PostedPosted 2 days ago,"Evaluates data by searching for trends and understanding the financial terms of the contracts.
Validate appropriate data from internal and third-party systems…"
230,Business Intelligence Analyst,PSCU,Full-time,Remote,PostedPosted 10 days ago,Validate and Analyze large data sets by profiling individual data points to determine data definitions & usefulness in analysis to end users becoming the…
231,Sr. Director of Products - AI/ML - Remote,UnitedHealth Group,"$134,200 - $257,700 a year","Remote in Bellevue, WA 98005",PostedPosted 4 days ago,"Demonstratable experience in technical product management in cloud computing, data science, or applied machine learning."
232,Business Intelligence Engineer,Meta,On call,Remote,PostedPosted 3 days ago,"Work closely with Data Engineers on the team to identify data sources, build scalable data models, and operationalize the data analytics."
233,"Executive Director, Strategy and Operations for Health Insights",CVS Health,"$131,500 - $297,250 a year","Remote in Washington, DC",PostedPosted 8 days ago,"Experience in data analysis and budget management.
Galvanize other teams (partner ops teams and general managers, finance, data science, product, senior…"
234,Healthcare Reporting Analyst | Remote in Virginia,UpStream,Full-time,Remote,PostedPosted 7 days ago,Be an advocate for the data and analytics needs of the populations and markets you support and work closely with our analytics development and data science…
235,Cyber Insider Threat and Digital Investigations Threat Detection and Content Developer (Remote Eligible),Capital One,Full-time +1,"Remote in McLean, VA",PostedPosted 3 days ago,1+ years of experience in data science and machine learning automating data collection and processing activities.
236,Senior Data Engineer (Remote),Standvast Fulfillment,"$130,000 - $160,000 a year",Remote,PostedPosted 5 days ago,"3 years data pipeline development in support of data science and analytics.
Data pipeline development,science,analytics: 3 years (Required)."
237,Machine Learning Operations Engineer,"GETTR USA, Inc",Full-time,"Remote in Manhattan, NY",PostedPosted 11 days ago,"Data science models testing, validation and tests automation.
Ability to understand tools used by data scientist and experience with software development and…"
238,"Data Management Specialist, Educational Research",The Rector & Visitors of the University of...,"$55,000 - $62,000 a year","Remote in Charlottesville, VA 22903",PostedPosted 5 days ago,"An understanding of data confidentiality principles to ensure data security.
Develop and implement systems for effective data management and data security,…"
239,Senior Data Scientist (Remote),Turn Technologies,Full-time,"Remote in Chicago, IL",PostedPosted 10 days ago,"You are smart and driven and have a passion for numbers and modeling.
As a Senior Data Scientist you'll also be expected to work independently and be self…"
240,Fraud Data Scientist & Reporting Specialist,Innovative Emergency Mgmt,Full-time,"Remote in Morrisville, NC",PostedPosted 8 days ago,"Building business cases and justification with data to drive decisions.
Analyzing data to help drive the approach and prioritization for the initiative."
241,Senior Data Analyst,CarePoint Health,"$90,000 - $120,000 a year","Remote in Salt Lake City, UT",PostedPosted 5 days ago,"Bachelor’s degree in computer science, information systems, information management, data science, applied mathematics, social sciences, or a related field…"
242,Senior Data Analyst (remote),Ad Hoc Team,"$81,666 - $115,934 a year","Remote in Washington, DC",PostedPosted 4 days ago,"This may include components of data analytics, data visualization, or data science.
Experience with data modeling, data warehouses, and data visualization best…"
243,"Principal Analyst, BI Visualization",Scalepex,Full-time,Remote,PostedPosted 10 days ago,"The DNA team provides functional expertise across an end-to-end data and analytics ecosystem that consists of strategic analytics, business intelligence, big…"
244,Security Compliance Analyst,HealthVerity,Full-time,Remote,PostedPosted 5 days ago,"Keep up to date on data science tools and distributed computing methodologies.
Manage security information gathering (SIG) requests by ensuring accurate and…"
245,Senior Data Scientist,Tech Intellectuals,"Up to $230,000 a year",Remote,PostedPosted 3 days ago,"Applies data science acumen to architect end-to-end data science solutions that best fits the client needs.
Provide data science resource and effort estimates…"
246,Senior Data Engineer,Precision Systems,Full-time +1,Remote,PostedPosted 2 days ago,"You'd build out data pipelines to support data Science models to enable automated data processing and increased efficiency.
Job Types: Full-time, Contract."
247,Data Scientist - Modeling (Remote),GovCIO,Full-time,"Remote in Fairfax, VA 22033",PostedPosted 1 day ago,"In this role you will directly support a chief data scientist team lead, working alongside analytics and data science professionals."
248,Machine Learning Engineer (Remote),CyberCoders,"$150,000 - $215,000 a year","Remote in San Diego, CA 92123",PostedPosted 2 days ago,"Ensure optimal/reliable data pipelines to support the product ML system.
This person will apply AWS -based ML technologies to embed ML and AI models and…"
249,Bi-lingual Spanish Nurse Navigator - Home Based (pharma call center exp required) - 2870078,IQVIA,"$66,000 - $82,000 a year",Remote,PostedPosted 2 days ago,The Nurse Navigator will have primary responsibility/accountability for providing superior customer service during one-on-one communications with patients…
250,Machine Learning Engineer,Reflections Info Systems,"$85,672 - $224,059 a year",Remote,PostedPosted 9 days ago,"Candidates with good skills in mathematics/ computer science/ statistics/ data science are welcome.
Python, Machine Leaning , Deep Learning, Computer vision."
251,Data Engineer - Jumpstart 12.13,Centeva,"$75,000 - $95,000 a year",Remote,PostedPosted 3 days ago,Develop and maintain new or existing multidimensional structures that contain data aggregated from many data sources for data mining and predictive/forecasting…
252,Senior Data Scientist,Kaygen,"$200,000 - $230,000 a year",Remote,PostedPosted 3 days ago,"Applies data science acumen to architect end-to-end data science solutions that best fits the client needs.
Provide data science resource and effort estimates…"
253,"Data Analyst, CVN Institute for Quality",Cohen Veterans Network,Full-time,"Remote in Stamford, CT 06902",PostedPosted 4 days ago,"BS or MS in data analytics/data science or related field.
Ability to interpret data dictionaries & identify correct data fields in relation to data queries &…"
254,"Industry Field CTO, Retail",Snowflake,"$197,000 - $280,000 a year",Remote,PostedPosted 3 days ago,"Identify, recruit and map potential ISV partners and marketplace providers to target reference architecture, data sets and use cases."
255,"Data Scientist, Clinical Research (Remote - U.S. only)",Lyra Health,Full-time,"Remote in Burlingame, CA 94010",PostedPosted 5 days ago,"Partner with data engineers to build pipelines that apply clinical logic to raw data.
Become an expert in the data we collect and use that data to enable us to…"
256,Senior Data Analyst,Spectrum Careers,"$70,000 - $95,000 a year","Remote in Washington, DC",PostedPosted 2 days ago,"Analysis of complex data from various organizational platforms.
Monitor and maintain the data integrity and integrations platforms.
Experience with SQL and R."
257,Adjunct Instructor - Machine Learning/AI - CTU Online,Perdoceo Education Corporation,Part-time,Remote,PostedPosted 3 days ago,Consistent with and supportive of CTU’s mission (to provide industry-relevant higher education to a diverse student population through innovative technology and…
258,Engineering Manager,Engtal,"$170,000 - $220,000 a year",Remote,PostedPosted 3 days ago,"Collaborate with fellow engineers and data scientists across the organization.
You have 10+ years of real-world professional experience writing back end or data…"
259,Data Scientist | Remote-US,IXIS Digital,Full-time,"Remote in Burlington, VT 05401",PostedPosted 7 days ago,"Experience developing data science solutions within a cloud environment (ideally AWS) a plus.
Experience working with real-world datasets, including database…"
260,Actuarial Assistant- Reserving (Remote),Selective Insurance Company of America,"$59,400 - $97,700 a year","Remote in Branchville, NJ 07890",PostedPosted 5 days ago,"With appropriate guidance, prepare data files and templates.
Prepare routine data submissions, with direction from supervisor."
261,Machine Learning Researcher,VERSES,"$100,000 - $130,000 a year",Remote,PostedPosted 10 days ago,"Advanced degree in a quantitative field, with experience in computer science, data science, statistics and operations research."
262,Machine Learning Engineer,"Zoom Video Communications, Inc.",Full-time,Remote,PostedPosted 8 days ago,"Manage data ingestion processes, oversee labeling efforts and monitor data quality to support your own machine learning models.
Hear from our leadership team."
263,REMOTE Role Python Developer( with Data Science Knowledge),Cognizant Technology Solutions,Full-time,"Remote in Durham, NC 27701",PostedPosted 9 days ago,"Overall 5+ years’ IT experience with technical skills.
Experience with Python for Data Science Server applications REST APIs PostgreSQL and MS SQL."
264,Senior Director of Data Operations & Analytics,Sendoso,Full-time,Remote,PostedPosted 7 days ago,"This individual is responsible for leading and growing a team of data engineers, data scientists, and data analysts."
265,Solar Engineering Consultant,ArcVera Renewables,"$95,000 - $120,000 a year",Remote,EmployerActive 4 days ago,"Knowledge of data science concepts such as machine learning.
Master’s degree in a physical science, engineering, data science or statistics from an accredited…"
266,Senior Human Resources Data Analyst,University Corporation for Atmospheric Research,"$89,420 - $111,775 a year","Remote in Boulder, CO 80305",PostedPosted 2 days ago,"Proficient in SQL programming for data analysis.
Experience in Human Resources functions to be able to assimilate and understand data stories."
267,Data Business Analyst,TEKsystems,Contract,"Remote in Charlotte, NC 28201",PostedToday,"O Experience with working on data, analytics, or data science efforts in an agile manner.
This workstream is focused on enabling modern advanced analytics tools…"
268,Senior Data Scientist,Big Fish Games,Full-time,"Remote in Las Vegas, NV 89135",PostedToday,"Minimum 1-3 years in a data science function.
You'll be responsible for supporting A/B test design and analysis, building machine learning models, and helping…"
269,Sr. ESG Data Analyst,James Hardie,Full-time,Remote,PostedPosted 12 days ago,"Minimum of 2 years experience in sustainability data collection, analysis and reporting preferred.
Understanding of Scope 1, 2, 3 carbon emission accounting and…"
270,Associate Analyst,Fraym,Full-time,"Remote in Arlington, VA 22201",PostedPosted 5 days ago,"Some formal training/coursework in data engineering, data science, statistical methods, econometrics, and/or geospatial analysis."
271,Machine Learning Engineer,Red Hat Software,Full-time,Remote,PostedPosted 4 days ago,Work closely with data engineering and machine learning operations (“MLOps”) functional roles to operationalize scalable data science solutions through…
272,Sr. Data Engineer- Work from home - Evernorth,Cigna,"$115,100 - $191,800 a year","Remote in Bloomfield, CT",PostedPosted 8 days ago,"Help design re-usable data ingestion, extractions and aggregation frameworks using AWS services to provide the well curated data for application, data science,…"
273,Data Scientist II (Remote),Inland Empire Health Plans,"$126,256 - $160,992 a year","Remote in Rancho Cucamonga, CA 91730",PostedPosted 12 days ago,"Lead and drive cross functional data science projects from beginning to end: build relationships with partner teams, frame and structure questions, collect and…"
274,Sr. Clinical Data Analyst,Endologix,Full-time,"Remote in Irvine, CA 92618",PostedPosted 1 day ago,"Assists in data cleaning processes.
Define and understands the data review requirements and processes to ensure delivery of the highest quality of data and the…"
275,Senior Data Scientist,Humana,Full-time,"Remote in Louisville, KY 40202",PostedPosted 3 days ago,"Develops, maintains, and collects structured and unstructured data sets for analysis and reporting.
Experience in developing, maintaining, and collecting…"
276,"Director Data Analytics, Healthcare Economics - Remote",UnitedHealth Group,"$113,500 - $218,100 a year","Remote in Eden Prairie, MN 55346",PostedPosted 9 days ago,"Proficiency with MS Excel for data analysis.
8+ years of experience performing analysis on healthcare administrative claims data, EHR/EMR data, or complex…"
277,"Data Analyst, Federal Civilian",Ad Hoc Team,"$81,666 - $115,934 a year","Remote in Washington, DC",PostedPosted 2 days ago,"Participate in interviewing for data roles and data capability development at Ad Hoc.
Collaborate with team of data analysts, data scientists/statisticians, and…"
278,Machine Learning Engineer,TekWissenGroup,Up to $75 an hour,Remote,PostedPosted 2 days ago,"Experienced in using SQL for querying data from relational tables.
Work collaboratively with data scientists, machine learning engineers, and program and…"
279,Data Scientist,TEKsystems,Contract,"Remote in San Antonio, TX 78201",PostedPosted 4 days ago,"Addresses capacity planning requests, performs data collection, data analysis and reporting for DHA Applications and end user support."
280,Data Scientist Senior #1730,Manufacturing Technical Solutions (MTS),Full-time,"Remote in Vienna, VA",PostedPosted 8 days ago,"Experience leading data science projects.
Lead and/or contribute to data science projects utilizing a variety of data science skills and methods."
281,Senior Data & Analytics Manager - Insurance Industry,H.W. Kaufman Group,Full-time,Remote,PostedPosted 3 days ago,"The Senior Data & Analytics manager is responsible for all aspects of data governance, including developing the overall data architecture strategy and creating…"
282,Lead Data Scientist - Remote - Healthcare,Michael Page,"$166,387 - $207,984 a year","Remote in Boston, MA 02110",PostedPosted 1 day ago,"Deep technical expertise in data science, statistical modeling and/or machine learning.
Experiment with customer behavior data, to enable stakeholders to…"
283,Senior Data Scientist,CyberCoders,"$140,000 - $160,000 a year","Remote in Boston, MA 02127",PostedPosted 4 days ago,"Integrate data from a variety of sources, assuring that they adhere to data quality and accessibility standards.
Improve data consistency and integrity."
284,Business / Data Analyst,The Rector & Visitors of the University of...,Full-time,"Remote in Charlottesville, VA 22903",PostedPosted 5 days ago,"Collaborating with data operations teams to integrate data into the data warehousing structure and understand how information is stored, modeled, and tagged."
285,"Associate Director, Business Analyst",IQVIA,Full-time,Remote,PostedPosted 14 days ago,"Excellent knowledge of data and analytics technologies required to translate data to insight.
In this role you’ll assist with the leadership, management,…"
286,Data Scientist,RSI,Full-time,Remote,PostedPosted 10 days ago,"Knowledge of ETL techniques, data mining, and data models.
A data scientist will have experience deploying statistical methods and machine learning models to…"
287,Machine Learning Scientist - (Open from Asst to Director-Level) - (100% Remote Throughout US),Moody's,Full-time,"Remote in Lebanon, KS",PostedPosted 1 day ago,"In the Predictive Analytics AI group, we build data-driven, highly distributed machine learning systems.
The Predictive Analytics AI Group is the central group…"
288,Senior Data Scientist,Purple Drive Technologies,"Up to $200,000 a year",Remote,PostedPosted 3 days ago,"Applies data science acumen to architect end-to-end data science solutions that best fits the client needs.
Provide data science resource and effort estimates…"
289,Actuarial Analyst,Ascension,"From $69,555 a year","Remote in Ballwin, MO 63021",PostedPosted 3 days ago,"Perform data analysis and synthesize results.
Analyze data for the development of reports and strategic recommendations.
Schedule: 8 hour shift, Monday-Friday."
290,Senior Data Analyst,RR Donnelley,Full-time,Remote,PostedPosted 10 days ago,"Acquire and aggregate data from a variety of sources; audit contents and ensure proper usage of data fields; merge, summarize, and transform data as required…"
291,Software Engineer - REMOTE,CyberCoders,"$130,000 - $150,000 a year","Remote in Los Angeles, CA 90034",PostedPosted 4 days ago,"We are a breakthrough AI diagnostics company with an immediate 100% REMOTE opening for a Software Engineer who will apply data science, machine learning, and…"
